{
  "schema_version": "1",
  "task_id": "task-8873feba07b8",
  "plan_hash": "sha256:ab34ef0102030405060708090a0b0c0d0e0f101112131415161718191a1b1c1d",
  "base_sha": "5f1c2b3a4d5e6f708192a3b4c5d6e7f8091a2b3c",
  "head_sha": "9a8b7c6d5e4f3120a1b2c3d4e5f60718293a4b5c",
  "summary": "No blocking findings.",
  "findings": [
    {
      "severity": "low",
      "path": "docs/index.md",
      "line": 12,
      "message": "Wording could be clearer",
      "evidence": "The sentence reads ambiguously",
      "reproduction": "Read line 12 in context"
    }
  ],
  "repository": "owner/repo"
}
